{
  "title": "Junior Solidity Developer",
  "description": "Demonstrated mastery of EVM storage mechanics, Foundry testing suite, custom error gas optimization, and access control patterns in Solidity 0.8.20.",
  "issuer": {
    "name": "Web3 Developer Guild",
    "address": "0x328809Bc894f92807417D2dAD6b7C998c1aFdac6",
    "website": "https://guild.web3.example"
  },
  "recipient": {
    "name": "Azfa",
    "address": "0x1D96F2f6BeF1202E4Ce1Ff6Dad0c2CB002861d3e"
  },
  "skills": [
    "Solidity",
    "Foundry",
    "EVM Mechanics",
    "Smart Contract Security",
    "Gas Optimization"
  ],
  "evidenceUrl": "https://github.com/proffound-project/proof-1",
  "issuedAt": "2026-09-17T04:30:00Z"
}
